assessment,id,title,text,priority,potential,parent
orange,Ü,"Übergreifend","Übergreifend",5,,

green,Ü1,"Klimaschutzkoordination (Klenko) personell ausbauen","Klimaschutzkoordination (Klenko) personell ausbauen",5,(5),Ü
white,Ü1-Plan,"geplant","Die Klenko war mit 2 Stellen besetzt. Bei der Vielzahl der Themen und Ansprüche war eine deutliche Überbelastung der Mitarbeiter zu verzeichnen und neue Projekte konnten nicht mehr in Angriff genommen werden oder bestehende nicht mehr ausgebaut werden.",5,(5),Ü1
green,Ü1-13,"Sachstand 2013","Die Klenko ist nunmehr personell auf 4 Personen aufgestockt worden und das Arbeitsspektrum konnte entsprechend dem Handlungskonzept 2020 ausgeweitet werden. Neue Themen wie die Klimaanpassung sollen in Zukunft ebenfalls angegangen werden.",5,(5),Ü1
green,Ü1-1516,"Sachstand 2015/2016","Die Klenko ist im September 2016 durch zwei befristete Masterplanstellen (vier Jahre) aufgestockt worden, so dass nunmehr insgesamt 6 Personalstellen zur Verfügung stehen. Zwei Stellen sind auf Grund von Mutterschutz und Umbesetzung der Mitarbeiter zurzeit (Mitte 2016 bis Anfang 2018) unbesetzt (Themenbereiche „Bauen und Sanieren“ sowie „Gewerbe und Erneuerbare Energien“).",5,(5),Ü1
green,Ü1-1718,"Sachstand 2017 / 2018","Seit Anfang 2018 sind alle 6 Personalstellen der Klenko besetzt. Zum September 2018 wird die Klenko durch 1,5 Personalstellen im Bereich Klimaanpassung ergänzt, wobei die Vollzeitstelle befristet (max. drei Jahre) vom Bundesumweltministerium gefördert wird.",5,(5),Ü1

red,Ü2,"Klimaschutzfond zur Finanzierung eines Teils der zusätzlichen Maßnahmen und Projekte","Klimaschutzfond zur Finanzierung eines Teils der zusätzlichen Maßnahmen und Projekte",5,4,Ü
white,Ü2-Plan,"geplant","Zur Finanzierung eines Teils der zusätzlichen Maßnahmen und Projekte soll ein Klimaschutzfond eingerichtet werden. Finanzierung z.B. aus den Gewinnen der Stadtwerke Münster sowie möglichst ergänzend durch weitere Unternehmen in der Stadt Münster.",5,4,Ü2
red,Ü2-13,"Sachstand 2013","Auf Grund der angespannten Haushaltslage ist die Umsetzung eines Klimaschutzfonds zurzeit nicht möglich, da der nötige Grundstock nicht gebildet werden kann.",5,4,Ü2
red,Ü2-1516,"Sachstand 2015 / 2016","Kein neuer Sachstand",5,4,Ü2
red,Ü2-1718,"Sachstand 2017 / 2018","Kein neuer Sachstand",5,4,Ü2

green,Ü3,"Klima-Check von Ratsbeschlüssen","Klima-Check von Ratsbeschlüssen",4,-,Ü
white,Ü3-Plan,"geplant","Systematik zur durchgängigen Prüfung der Auswirkungen von Ratsbeschlüssen auf Klimaschutzstrategie und Klimagasausstoß.",4,-,Ü3
red,Ü3-13,"Sachstand 2013","Das Projekt ist bislang noch nicht in Angriff genommen worden, da es im Rahmen der Zuständigkeitsregelung für den Klimaschutz eingebunden werden soll. Die Umsetzung eines Klimacheck für Ratsbeschlüsse sollte zur Erleichterung der Arbeit des Beirates für Klimaschutz beitragen.",4,-,Ü3
red,Ü3-1516,"Sachstand 2015 / 2016","Kein neuer Sachstand",4,-,Ü3
green,Ü3-1718,"Sachstand 2017 / 2018","Im Rahmen der Einführung der Anlage A zu allen Ratsvorlagen wird die Relevanz des Klimaschutzes als Querschnittthema hervorgehoben werden. Dabei soll das Querschnittsthema im Sinne eines Positivkatalogs erwähnt werden, wenn der mit der Vorlage zu entscheidende Sachverhalt bzw. der Bericht klimaschutzrelevante Aussagen trifft und dies für die Beschlussfassung und Entscheidung von unmittelbarer und grundsätzlicher Bedeutung und Relevanz ist.",4,-,Ü3

green,Ü4,"Münsters Allianz für Klimaschutz","Münsters Allianz für Klimaschutz",5,(5),Ü
white,Ü4-Plan,"geplant","Aufbau eines stadtweiten Netzwerkes 'Allianz für Klimaschutz' mit gesellschaftlichen Akteuren aus Wirtschaft, Handwerk, Dienstleistung., etc. zur Entwicklung und Umsetzung von Klimaschutzmaßnahmen in den Bereichen.",5,(5),Ü4
green,Ü4-13,"Sachstand 2013","Im Mai 2011 wurde die Allianz für Klimaschutz gegründet. Gleich zu Beginn traten 40 Unternehmen der Allianz bei. Im zweiten Projektjahr konnte die Teilnehmerzahl auf 70 Unternehmen erhöht werden. Die Unternehmen, Institutionen und Verbände haben sich bisher in mehr als 45 Workshops und Fachveranstaltungen getroffen und mit Hilfe externer Experten Ideen und Projekte für die Einsparung von Energie in den Betrieben entwickelt. Der Fokus lag auf den Themenbereichen Sofortmaßnahmen und Mitarbeitermotivation, Energie-Controlling, Green IT, LED, Optimierung der Regelungstechnik, Solare Eigenstromerzeugung, energieeffiziente Kältetechnik und Mobilitätsmanagement. Eine besondere Rolle kommt den so genannten Klima-Paten zu. Sie definieren Ziele, treiben konkrete Projekte voran und repräsentieren die Allianz in der Öffentlichkeit. Dazu treffen sich Vertreter der Firmengruppe Brück, der Sahle Baubetreuungsgesellschaft mbH, der Westfälischen Provinzial Versicherung AG, der Kenersys GmbH, der Stadtwerke Münster GmbH und des Batterieforschungsinstituts MEET der Universität Münster einmal jährlich mit Oberbürgermeister, Verwaltungsspitze und Politik.",5,(5),Ü4
green,Ü4-1516,"Sachstand 2015 / 2016","Mittlerweile konnte die Teilnehmerzahl der Unternehmen auf mehr als 100 gesteigert werden. Neben den Workshops, die dazu dienen, den Unternehmen das notwendige Fachwissen zu vermitteln, wurde eine intensive Öffentlichkeitsarbeit umgesetzt. Das Marketingkonzept, bei dem die Unternehmen unterschiedliche Module beauftragen konnten, hat u.a. folgende Bausteine enthalten: Imagefilm, Klimanews (Auflagenstärke rund 55.000 Stück als Zeitungsbeilage), Buswerbung für 1 Jahr auf Stadtwerke-Bussen, Plakatwerbung, Pressemitteilungen. Die Intensivierung der Öffentlichkeitsarbeit hat zu einer deutlichen Stärkung der Außenwirkung sowohl des Projektes als auch der teilnehmenden Unternehmen geführt. In den Jahren von 2013 bis 2016 haben jährlich Koordinierungstreffen stattgefunden, um auf die Wünsche und Bedürfnisse der Unternehmen einzugehen, die Inhalte zielgerichtet zu steuern und weiter zu verfolgen. Eine Abfrage im Jahr 2016 durch das beauftrage Unternehmen Gertec GmbH, dass seit der Gründung des Netzwerkes die Umsetzung des Projektes begleitet, konnte aufzeigen, dass die Unternehmen mit den Angeboten sehr zufrieden gewesen sind und dabei besonders die flexiblen inhaltlichen, auf aktuelle Entwicklungen bezogenen Angebote und den Austausch untereinander sehr Wert schätzen.",5,(5),Ü4
,Ü4-1718,"Sachstand 2017 / 2018","Die Zahl der Mitglieder im Netzwerk Münsters Allianz für Klimaschutz liegt weiterhin bei über 100 Unternehmen, wobei der zentrale Fokus des Netzwerks nach wie vor auf die Realisierung von Maßnahmen und Projekten innerhalb der Unternehmen gesetzt wird. Dazu haben sich insbesondere die regelmäßig durch die Stadt Münster angebotenen fachlichen Workshops etabliert, die immer in einer Kombination aus Fachwissen und konkreten praxisnahen Beispielen die Teilnehmer motivieren und anregen derartige Maßnahmen und Projekte auch im eigenen Unternehmen umzusetzen. Ein besonderer Fokus wurde im Jahr 2017 auf das Thema Mobilität mit dem Schwerpunkt Elektromobilität gelegt. Im Bereich der Öffentlichkeitsarbeit erscheint jährlich die Klimanews (Auflagenstärke rund 55.000 Stück als Zeitungsbeilage), in der die beteiligten Unternehmen die Möglichkeit haben ihre erfolgreichen Klimaschutzmaßnahmen der Öffentlichkeit zu präsentieren. Neben den technischen energetischen Einsparpotentialen ist im Frühjahr 2018 der Schwerpunkt auf eher verhaltensorientierte Ansätze zum Klimaschutz gelegt worden. Dabei stand die Verbindung von Klimaschutz und Mitarbeitermotivation (Attraktivität des Arbeitgebers) im Fokus. Themen waren Klimaschutz am Arbeitsplatz (Büroausstattung), Klimaschutz und Ernährung sowie Klimaschutz und Mobilität (Vermeidung von Wegen, Home Office, etc.). Die konstante Beteiligung der Unternehmen an den Veranstaltungen, eine geringe Fluktuation im Netzwerk und die Rückmeldung aus regelmäßigen persönlichen Beratungsgesprächen durch das beauftrage Beratungsbüro und der Stadt Münster zeigen, dass die Kooperation zwischen den beteiligten Unternehmen und der Stadt Münster in dieser Form sehr gut funktioniert.",5,(5),Ü4

green,B,"Bauen und Wohnen","Bauen und Wohnen",5,,

orange,B1,"Gütesiegel Gebäudesanierung","Gütesiegel Gebäudesanierung",5,(3),B
white,B1-Plan,"geplant","Entwicklung eines Gütesiegels Gebäudesanierung ist im Rahmen der Workshops für das Klimaschutzkonzeptes als ein sehr wichtiges Instrument der Altbausanierung gesehen worden.",5,(3),B1
green,B1-13,"Sachstand 2013","Das seit 1997 bestehende Gütesiegel für vorbildlich sanierte Altbauten ist in 2012 novelliert und in zwei Varianten (Standard und Premium) an die aktuellen Anforderungen der Energieeinsparverordnung breitenwirksam angepasst worden. Jährlich wiederkehrend können sich nunmehr Gebäudeeigentümer mit dem nach der Sanierung ausgestellten Energieausweis für das Gebäudegütesiegel der Stadt Münster bis Anfang September bewerben. In 2012 sind 55 Gebäudegütesiegel vergeben worden.",5,(3),B1
orange,B1-1516,"Sachstand 2015 / 2016","Die Grundidee eines Gütesiegels für gut sanierte Wohngebäude ist nach wie vor ein gutes und wichtiges Instrument für die öffentlichkeitswirksame Werbung zur Sanierung von Wohngebäuden, jedoch ist die Nachfrage durch mögliche Bauherren - trotz intensiver Bewerbung in allen Medien und mit einer Vielzahl an Multiplikatoren - eher gering. In 2013 sind 25, in 2014 sind 40 und in 2015 sind 30 Gütesiegel vergeben worden (vorrangig an Antragsteller aus dem Förderprogramm Altbausanierung und Energieeinsparung der Stadt Münster). In 2016 konnte auf Grund des Personalausfalls (vgl. Ü1) keine Auszeichnung stattfinden.",5,(3),B1
red,B1-1718,"Sachstand 2017 / 2018","Auch im Jahr 2017 konnte auf Grund des Personalausfalls (vgl. Ü1) keine Auszeichnung stattfinden. In 2018 ist eine Auszeichnung für die vorangegangenen Jahre geplant.",5,(3),B1


,B2,"Förderprogramm „Energieeinsparung und Altbausanierung“","Förderprogramm „Energieeinsparung und Altbausanierung“",4,5,B
white,B2-Plan,"geplant","Förderprogramm soll fortgeführt werden. Wichtig ist ein hohes Budget, um Breitenwirkungen zu erzielen. Zudem Weiterentwicklung z.B. Konzentration auf Außenwanddämmung, Innendämmungsqualität, Passivhauselemente, Hemmnis Denkmalschutz, Dachintegration von Solaranlagen",4,5,B2
orange,B2-13,"Sachstand 2013","Mit Ratsbeschluss zum Handlungskonzept 2020 (V/0592/2010 + V/0592/2010/E1) ist die Fortführung des Förderprogrammes mit einem Haushaltsvolumen von 350.000 Euro pro Jahr beschlossen worden. Im Rahmen der Haushaltskonsolidierung 2012 wurden die Mittel für die Jahre 2013 bis 2017 auf jeweils 250.000 Euro reduziert.",4,5,B2
green,B2-1516,"Sachstand 2015 / 2016","Die Haushaltsmittel für das Förderprogramm sind im Jahr 2014 wieder auf 350.000 Euro aufgestockt worden und betragen in folgenden Jahren:<br>2015 -> 400.000 Euro<br>2016 -> 425.000 Euro<br>2017 -> 450.000 Euro<br>2018 -> 500.000 Euro<br>2019 -> 350.000 Euro<br>2020 -> 350.000 Euro<br>Der jährliche Fördertopf war teilweise bereits im Frühjahr ausgeschöpft. Im Jahr 2015 sind Fördermittel in Höhe von 125.000 Euro nicht abgerufen worden, da die bundesweite Negativpresse in Sachen „Dämmwahn“ auch in Münster seine Wirkung gezeigt hat. Im Jahr 2016 sind jedoch wieder alle Fördermittel bis zum Jahresende abgerufen worden. Seit Mitte 2016 erfolgt die Förderung von Photovoltaikanlagen durch ein städtisches Förderprogramm, welches in das Förderprogramm Altbausanierung und Energieeinsparung integriert worden ist (vgl. E6).",4,5,B2
green,B2-1718,"Sachstand 2017 / 2018","Aufgrund der stetigen Pressearbeit sind im Jahr 2017, wie auch im vorangegangenen Jahr, fast alle Fördermittel abgerufen worden. Lediglich 42.000 € sind nicht in Anspruch genommen worden. In 2018 sind bis Juli für die Altbausanierung bereits über 300.000 € abgerufen worden. Im Rahmen der Haushaltsberatungen 2018 sind die Fördermittel für die folgenden Jahre nochmals aufgestockt worden:<br>2019 -> 450.000 Euro<br>2020 -> 450.000 Euro<br>2021 -> 500.000 Euro<br>2022 -> 500.000 Euro",4,5,B2


green,G,"Gewerbe, Handel, Dienstl.","Gewerbe, Handel, Dienstl.",5,,

,G1,"Energie-Coaching für KMU und deren Fachplaner","Energie-Coaching für KMU und deren Fachplaner",4,(1),G
white,G1-Plan,"geplant","Aufbau eines Pools von Energie-Beratern, die kostenpflichtig für KMU als Spezialisten für Energieeffizienz arbeiten und diese beraten.",4,(1),G1
green,G1-13,"Sachstand 2013","Eine Startberatung „Energieeffizienz für Unternehmen“, die mit einen Zeitrahmen von ca. zwei Stunden vor Ort durch externe Fachingenieure durchgeführt wird, ist entwickelt und umgesetzt worden. Zielsetzung war es, kleine und mittelständische Unternehmen für das Thema Energieeffizienz und Klimaschutz zu sensibilisieren sowie Sparpotenziale und Lösungsansätze aufzuzeigen. Als Pilotprojekt wurde allen 27 Betrieben des Gewerbegebietes „Zum Kaiserbusch“ die Teilnahme angeboten. 12 Betriebe haben das Angebot angenommen. In der zweiten nun folgenden Stufe werden die beratenen Unternehmen noch mal angesprochen und der Umsetzungsstand nachgefragt sowie ggf. Hilfestellung bei der Umsetzung angeboten. In 2013 sollen in den Startberatungen Empfehlungen für ein mögliches Energiecontrolling (G3) einfließen. Eine Auszeichnung der Betriebe mit einem Siegel/Label ist ebenfalls in Planung.",4,(1),G1
red,G1-1516,"Sachstand 2015 / 2016","Nach der Pilotphase wurde das Projekt flächendeckend den Unternehmen in Münster angeboten. Bis Ende 2016 konnten jährlich 10 Startberatungen durchgeführt werden. 2016 konnten trotz intensiver Akquisebemühungen durch den Energieberater (externer Fachingenieur) nur 4 Startberatungen durchgeführt werden. Es ist geplant das Format der Akquise und der Ansprache neu zu überdenken. Die Auszeichnung mit einem Siegel/Label wurde nach einer Aufwand-/Nutzenabwägung verworfen.",4,(1),G1
orange,G1-1718,"Sachstand 2017 / 2018","In 2017 konnte das Projekt aufgrund personeller Engpässe nicht durchgeführt werden, da die zuständige Personalstelle erst Ende des Jahres wieder besetzt werden konnte. 2018 wurde das Ansprache- und Akquiseformat überarbeitet. Statt einer flächendeckenden Ansprache wurde sich auf die Unternehmen im Gewerbegebiet der Loddenheide konzentriert. Gemeinsam mit dem beauftragten Energieberater ist ein Mitarbeiter der Klenko gezielt auf die einzelnen Unternehmen zugegangen und hat diesen die Startberatung Energieeffizienz direkt vor Ort kurz vorgestellt und angeboten. Diese Vorgehensweise hat sich als sehr erfolgreich herausgestellt, so dass in 2018 20 Beratungen durchgeführt werden konnten. Das Angebot und das Anspracheformat soll in dieser Form beibehalten und in den nächsten Jahren in weiteren Gewerbegebieten durchgeführt werden.",4,(1),G1

green,G2,"Netzwerke für Erfahrungsaustausch im Sektor GHD","Netzwerke für Erfahrungsaustausch im Sektor GHD",5,-,G
white,G2-Plan,"geplant","Erfahrungsaustausch zwischen GHD-Unternehmen zu Themen wie Technische Anlagen (z.B. Beleuchtung, Kühlung/ Klimatisierung), Mitarbeitermotivation, Fuhrpark, etc.. Möglicher Bestandteil der geplanten „ Münsters Allianz für Klimaschutz.",5,-,G2
green,G2-13,"Sachstand 2013","Das Projekt ist in „Münsters Allianz für Klimaschutz“ (Ü4) integriert worden. Es sollten keine weiteren neuen Netzwerke oder Foren für Erfahrungsaustausche zusätzlich eingeführt werden, sondern das 2011 gegründete Netzwerk „Münsters Allianz für Klimaschutz“ ausgebaut werden.",5,-,G2
green,G2-1516,"Sachstand 2015 / 2016","Das Projekt ist weiterhin in „Münsters Allianz für Klimaschutz" (Ü4) integriert.",5,-,G2
green,G2-1718,"Sachstand 2017 / 2018",""Kein neuer Sachstand,5,-,G2


orange,E,"Energieumwandlung, EE","Energieumwandlung, EE",5,,

orange,E1,"Ausbau der Fernwärme (FW) in der Fläche","Ausbau der Fernwärme (FW) in der Fläche",5,5,E
white,E1-Plan,"geplant","Ausbau des bestehenden FW-Netzes im Umfeld vorhandener Fernwärmetrassen durch die Stadtwerke. Unterstützend soll ein Öko-Image für die Fernwärme aufgebaut werden, d.h. Verbesserung und Aufwertung des Image der Fernwärmeversorgung im Sinne eines ökologisch wertvollen Produktes wie z.B. Ökostrom.",5,5,E1
orange,E1-13,"Sachstand 2013","In Zusammenarbeit mit der Stadtwerke Münster GmbH ist in 2012 die Imagekampagne für die Fernwärme in Münster ausgearbeitet und gestartet worden. Im Rahmen der Haushaltskonsolidierung 2012 wurden die städtischen Haushaltsmittel für die Kampagne eingespart und die Stadtwerke Münster führen die Kampagne in den kommenden Jahren eigenständig fort.",5,5,E1
green,E1-1516,"Sachstand 2015 / 2016","Seit 2013 sind ca. 25.000 kW Anschlussleistung in 320 neuen Hausanschlüssen im Rahmen des Fernwärmeausbaus dazugekommen. Werbung für die Fernwärme erfolgte über unterschiedliche Medien (Bewerbung für FW-Förderprogramm vom 01.01.-31.12.2015; Redaktionelle Artikel zum Förderprogramm im Magazin "Wartung-Direkt"; regelmäßige Kommunikation in verschiedenen lokalen Medien).",5,5,E1
orange,E1-1718,"Sachstand 2017 / 2018","Seit 2013 sind ca. 35.000 kW Anschlussleistung in 390 neuen Hausanschlüssen im Rahmen des Fernwärmeausbaus dazugekommen. Da das FW-Förderprogramm Ende 2015 ausgelaufen ist und nicht neu aufgelegt wurde, ist auch die begleitende Präsens in den Medien deutlich reduziert worden. Aktuell werden in unregelmäßigen Abständen Anzeigen in Printmedien und im Kino geschaltet.",5,5,E1



green,E2,"Ausbau Kraft-Wärme-Kopplung (KWK) im Heizkraftwerk Uni","Ausbau Kraft-Wärme-Kopplung (KWK) im Heizkraftwerk Uni",5,5,E
white,E2-Plan,"geplant","Stadtwerke nehmen sich des Themas an und erarbeiten mit der Uni ein Konzept. Der aktuelle Vertrag läuft noch bis Oktober 2012.",5,5,E2
orange,E2-13,"Sachstand 2013","Nachdem die Prüfung zum Bau einer dritten Gasturbinenlinie (GT) am Standort des Gas- und Dampfturbinen – Heizkraftwerkes (GuD-Anlage) am Hafen ergeben hat, dass ein wirtschaftlicher Betrieb einer dritten GT unter den derzeitigen bzw. mittelfristig zu erwartenden Rahmenbedingungen nicht möglich erscheint, verfolgen die Stadtwerke Münster das KWK-Ausbauziel durch die Projektierung von Groß-BHKWs, die in das Fernwärmenetz eingebunden werden sollen. Durch große BHKWs in der Netzperipherie, die mit Wärmespeichern kombiniert werden, wird der Erzeugungsanteil der in Kraft-Wärme-Kopplung erzeugten Fernwärme weiter gesteigert werden. Darüber hinaus kann durch die dezentrale Fernwärmeeinspeisung hydraulischen Engpässen im Fernwärmenetz begegnet werden. Die Stadtwerke haben ihr Konzept der Universität vorgestellt und befinden sich mit der Uni im Gespräch über diesbezüglich mögliche Standortkooperationen. Die laufende Kooperation in der Fernwärmeerzeugung wird über das Auslaufen der Lieferverträge im Oktober 2012 zzt. dergestalt fortgesetzt, dass der Uni KWK-Grundlastwärme im Rahmen der verfügbaren Kapazitäten aus der GuD-Anlage zu günstigen Konditionen zur Verfügung gestellt wird, so dass der Einsatz der eigenen Gas-Kessel am Orléansring entsprechend zurück gefahren werden kann.",5,5,E2
green,E2-1516,"Sachstand 2015 / 2016","Eine direkte Kooperation der Stadtwerke mit der Universität konnte aus wettbewerblichen Gründen nicht abgeschlossen werden. In den nachfolgenden Ausschreibungen konnten die Stadtwerke jedoch den Zuschlag erhalten und mit ihrem Angebot, KWK-Wärme günstig zu liefern, den Zuschlag erhalten und die Erzeugungsmenge konsequent am KWK-Modus der Anlage ausrichten. Die Angebotsstruktur begünstigt somit eine maximale KWK-Wärmeerzeugung. Die lokalen Gaseinsatzmengen der Universität sind deutlich zurückgegangen.",5,5,E2
green,E2-1718,"Sachstand 2017 / 2018","Die Universität schreibt ihren Erdgasbedarf zur Wärmeerzeugung im HKW Orléansring aus wettbewerblichen Gründen weiterhin regelmäßig aus. Die Stadtwerke konnten sich mit ihren Alternativangeboten zur Lieferung kostengünstiger KWK-Grundlastwärme aus der GuD-Anlage im HKW-Hafen im Wettbewerb erfolgreich behaupten. Dies ermöglicht eine maximale KWK-Wärmeerzeugung in Münsters Fernwärmesystem und die Gaseinsatzmengen der reinen Wärmeerzeugung verbleiben auf niedrigem Niveau.",5,5,E2



red,V,"Verkehr","Verkehr",5,,

,Vneu,"umfassendes Konzept für eine klimaschonende Verkehrsentwicklung, für Klimaschutz in der räumlichen Stadtentwicklung und im Städtebau","umfassendes Konzept für eine klimaschonende Verkehrsentwicklung, für Klimaschutz in der räumlichen Stadtentwicklung und im Städtebau",5,(5),V
white,Vneu-Plan,"geplant","Die Verwaltung wird beauftragt, ein umfassendes Konzept für eine Klima schonende Verkehrsentwicklung, für Klimaschutz in der räumlichen Stadtentwicklung und im Städtebau vorzulegen: Dabei sind für das Jahr 2020 folgende Ziele zu berücksichtigen:<br>- Die Anteile der umweltfreundlichen Verkehrsmittel im Stadtverkehr und der öffentlichen Verkehrsmittel im regionalen Verkehr sollen deutlich gesteigert werden,<br>- das weitere Wachstum der Siedlungsflächen im Stadtgebiet soll gestoppt und durch Innenentwicklung, durch Flächenrecycling und durch städtebauliche Verdichtung in den Siedlungskernen kompensiert werden,<br>- die Inanspruchnahme von Freiraum, insbesondere von land- und forstwirtschaftli-
chen Flächen für die Siedlungsentwicklung, soll beendet werden,<br>- Städtebauliche Planungen und Vorhaben sind grundsätzlich auf die Ziele der Energieeinsparung, der Energieeffizienz und der Nutzung Erneuerbarer Energien auszurichten.<br> Die bislang im Klimaschutzkonzept 2020 vorgesehenen Maßnahmen in den Bereichen Verkehr (V1– V12) sowie Stadtentwicklung/Städtebau (Ü8) werden in dieses Konzept integriert.",5,(5),Vneu
,Vneu-13,"Sachstand 2013","Die Verwaltung arbeitet kontinuierlich im Bereich der Gesamtverkehrsplanung. So wird aktuell der 3. Nahverkehrsplan der Stadt Münster als Teil des Gesamtprojektes „Mobilität Münster 2025“ (ehemals „VEP Münster 2025“) erstellt. Im Dezember 2012 wurden die zukünftigen Bedienungs- und Beförderungsqualitäten des ÖPNV in Münster be-
schlossen (V/0791/2012/1 „Dritter Nahverkehrsplan Stadt Münster – Rahmenvorgaben“). Mit dieser Vorlage wurde gleichzeitig das Ziel formuliert, den Anteil des ÖPNV am innerstädtischen Verkehr auf 15 Prozent zu steigern. Es ist geplant den Entwurf „Dritter Nahverkehrsplan Stadt Münster“ noch in 2013 der Politik vorzulegen.",5,(5),Vneu
,Vneu-1516,"Sachstand 2015 / 2016","Münster ist eine wachsende Stadt mit aktuell ca. 305.000 Einwohnern. Für das Jahr 2030 prognostiziert die Stadt Münster ein weiteres Einwohnerwachstum auf (je nach
Flüchtlingszustrom) ca. 326.000 – 347.00 Einwohner. Dies führt – zusammen mit den nach wie vor sinkenden Haushaltsgrößen – zu einer Zielzahl von mindestens 2.000 Neubauwohnungen im Jahr bei einem derzeit angespannten Wohnungsmarkt mit steigenden Mieten und Bodenpreisen. Um die Inanspruchnahme bisher nicht baulich genutzter Freiflächen zu minimieren, hat der Rat der Stadt Münster festgelegt, dass mindestens die Hälfte der Neubauwohnungen im Innenbereich und damit auf Brachflächen, im Gebäudeleerstand und in Baulücken errichtet werden sollen. Dieser Wert wurde in der Vergangenheit regelmäßig in Münster erreicht bzw. (z.T. deutlich) überschritten, indem konsequent insbesondere gewerbliche Brachflächen, militärische Konversionsflächen, aber auch bauliche Nachverdichtungsmöglichkeiten genutzt wurden. Trotz dieser intensiven und erfolgreichen Bemühungen reicht eine reine Innenentwicklung in Münster vor dem Hintergrund der o.a. erwarteten Bevölkerungsentwicklung und der daher zu berücksichtigenden Flächenbedarfe nicht aus, um ausreichend (bezahlbaren) Wohnraum zur Verfügung zu stellen können. Insofern ist es auch zukünftig erforderlich, in nach Möglichkeit begrenztem Umfang Freiraum in Anspruch zu nehmen, um auf diesen Flächen neuen Wohnraum zu schaffen. Die Verwaltung arbeitet kontinuierlich an der Verbesserung des Umweltverbundes im Bereich der Gesamtverkehrsplanung. So wurde aktuell der 3. Nahverkehrsplan der Stadt Münster am 17.02.2016 beschlossen. Das Radverkehrskonzept Münster 2025 als Teil des Gesamtprojektes „Mobilität Münster 2025“ (ehemals „VEP Münster 2025“) ist aktuell in der politischen Beratung (s. V 9). Mit dem 3. Nahverkehrsplan wurde das Ziel formuliert, den Anteil des ÖPNV am innerstädtischen Verkehr auf 15 Prozent zu steigern. Das Radverkehrskonzept gibt als lang fristiges Ziel eine Steigerung des Radverkehrsanteils in Münster von heute 40% auf 50% am Modal-Split an.",5,(5),Vneu
