assessment,id,title,text,priority,potential,parent
,Vneu-1718,"Sachstand 2017 / 2018","Münster ist eine wachsende Stadt mit aktuell ca. 309.000 Einwohnern. Für das Jahr 2030 prognostizieren sowohl das Land NRW als auch die Stadt Münster selbst ein weiteres Einwohnerwachstum auf mindestens ca. 326.000 Einwohner. Dies führt – zusammen mit den allgemein sinkenden Haushaltsgrößen – zum Bedarf von ca. 2.000 Neubauwohnungen im Jahr bei einem derzeit angespannten Wohnungsmarkt mit steigenden Mieten und Bodenpreisen. Das Einwohnerwachstum geht einher mit einem steigenden Bedarf an gewerblichen Bauflächen unter den im Sachstand 2015/2016 dargestellten Anforderungen. Um den Verkehrstechnischen Anforderungen gerecht zu werden, ist die Erarbeitung eines Masterplan Mobilität Münster 2035+ beschlossen worden. Auszug aus der Begründung zur Aufstellung eines Masterplans Mobilität Münster 2035+ (V/0802/2017):<br>Die dynamisch wachsende Stadt Münster steht vor großen Herausforderungen. Neben dem Thema „Schaffung von bezahlbarem Wohnraum“ zählt hierzu insbesondere die zukunftsfähige, stadt- und umweltverträgliche Gestaltung des Verkehrsgeschehens. Die heutige Verkehrsinfrastruktur mit ihren vielfach zu engen historischen Straßenquerschnitten entspricht allenfalls dem Verkehrsaufkommen einer Bevölkerung von rd. 260.000 Einwohnern, nicht aber einer Großstadt. Das aktuelle Verkehrssystem weist daher deutliche Kapazitätsengpässe und Defizite im motorisierten Individualverkehr (MIV), im Schienenpersonennahverkehr / Öffentlicher Personennahverkehr (SPNV/ÖPNV) und im Radverkehr auf. Der daraus resultierende massive Druck auf den begrenzt zur Verfügung stehenden öffentlichen Verkehrsraum ist vor allem zu den verkehrlichen Spitzenzeiten täglich sichtbar. Dies führt zu erheblichen Beeinträchtigungen hinsichtlich Wohn-, Lebens- und Aufenthaltsqualität vor allem im Kernstadtbereich. Insbesondere im Hauptverkehrsstraßennetz kommt es durch die Überlagerung des Münsteraner Verkehrs und der Zunahme des motorisierten Pendlerverkehrs zu deutlichen Leistungsfähigkeitsengpässen mit entsprechend negativen Auswirkungen (Lärm, Luft, etc.) für die Wohnbevölkerung. Auch die Verkehrssysteme des öffentlichen regionalen schienen- und straßengebundenen Verkehrs kommen in den Hauptverkehrszeiten an ihre Leistungsgrenzen. Zudem haben die vielfältigen Ansprüche der einzelnen Verkehrsträger und deren Nutzer an den öffentlichen Verkehrsraum qualitativ und quantitativ derart zugenommen, dass sie sich gegenseitig konkurrenzieren und um „ihre“ Verkehrsfläche „streiten“. Es liegt auf der Hand, dass es zu dieser Problematik keine „schlichten“ Lösungen geben kann, in dem die Verkehrsfläche einfach vergrößert wird. Dies ist in einer im Kern verdichteten Großstadt allein aufgrund der existierenden Bebauung weder möglich noch zielführend. Vielmehr stellt sich die komplexe Frage, wie mit der begrenzten Verfügbarkeit an Verkehrsfläche bei dynamisch wachsender Einwohnerzahl und hohem Pendleraufkommen das zukünftige Verkehrsgeschehen unter Einbeziehung der regionalen Verflechtungen intelligent und nachhaltig organisiert sowie finanziert werden kann. Hierauf soll der zur Erarbeitung empfohlene Masterplan „Mobilität Münster 2035+“ ziel- und umsetzungsorientierte Antworten geben. Damit ist der Masterplan ein zentraler Baustein für die dynamisch wachsende Stadt Münster. Im regionalen Kontext wird Münster damit zum Impulsgeber der Entwicklung eines zukunftsfähigen integrativen Mobilitätskonzeptes.",5,(5),Vneu
,Vneu-1718,"Sachstand 2017 / 2018","Münster ist eine wachsende Stadt mit aktuell ca. 309.000 Einwohnern. Für das Jahr 2030 prognostizieren sowohl das Land NRW als auch die Stadt Münster selbst ein weiteres Einwohnerwachstum auf mindestens ca. 326.000 Einwohner. Dies führt – zusammen mit den allgemein sinkenden Haushaltsgrößen – zum Bedarf von ca. 2.000 Neubauwohnungen im Jahr bei einem derzeit angespannten Wohnungsmarkt mit steigenden Mieten und Bodenpreisen. Das Einwohnerwachstum geht einher mit einem steigenden Bedarf an gewerblichen Bauflächen unter den im Sachstand 2015/2016 dargestellten Anforderungen. Um den Verkehrstechnischen Anforderungen gerecht zu werden, ist die Erarbeitung eines Masterplan Mobilität Münster 2035+ beschlossen worden. Auszug aus der Begründung zur Aufstellung eines Masterplans Mobilität Münster 2035+ (V/0802/2017):<br>Die dynamisch wachsende Stadt Münster steht vor großen Herausforderungen. Neben dem Thema „Schaffung von bezahlbarem Wohnraum“ zählt hierzu insbesondere die zukunftsfähige, stadt- und umweltverträgliche Gestaltung des Verkehrsgeschehens. Die heutige Verkehrsinfrastruktur mit ihren vielfach zu engen historischen Straßenquerschnitten entspricht allenfalls dem Verkehrsaufkommen einer Bevölkerung von rd. 260.000 Einwohnern, nicht aber einer Großstadt. Das aktuelle Verkehrssystem weist daher deutliche Kapazitätsengpässe und Defizite im motorisierten Individualverkehr (MIV), im Schienenpersonennahverkehr / Öffentlicher Personennahverkehr (SPNV/ÖPNV) und im Radverkehr auf. Der daraus resultierende massive Druck auf den begrenzt zur Verfügung stehenden öffentlichen Verkehrsraum ist vor allem zu den verkehrlichen Spitzenzeiten täglich sichtbar. Dies führt zu erheblichen Beeinträchtigungen hinsichtlich Wohn-, Lebens- und Aufenthaltsqualität vor allem im Kernstadtbereich. Insbesondere im Hauptverkehrsstraßennetz kommt es durch die Überlagerung des Münsteraner Verkehrs und der Zunahme des motorisierten Pendlerverkehrs zu deutlichen Leistungsfähigkeitsengpässen mit entsprechend negativen Auswirkungen (Lärm, Luft, etc.) für die Wohnbevölkerung. Auch die Verkehrssysteme des öffentlichen regionalen schienen- und straßengebundenen Verkehrs kommen in den Hauptverkehrszeiten an ihre Leistungsgrenzen. Zudem haben die vielfältigen Ansprüche der einzelnen Verkehrsträger und deren Nutzer an den öffentlichen Verkehrsraum qualitativ und quantitativ derart zugenommen, dass sie sich gegenseitig konkurrenzieren und um „ihre“ Verkehrsfläche „streiten“. Es liegt auf der Hand, dass es zu dieser Problematik keine „schlichten“ Lösungen geben kann, in dem die Verkehrsfläche einfach vergrößert wird. Dies ist in einer im Kern verdichteten Großstadt allein aufgrund der existierenden Bebauung weder möglich noch zielführend. Vielmehr stellt sich die komplexe Frage, wie mit der begrenzten Verfügbarkeit an Verkehrsfläche bei dynamisch wachsender Einwohnerzahl und hohem Pendleraufkommen das zukünftige Verkehrsgeschehen unter Einbeziehung der regionalen Verflechtungen intelligent und nachhaltig organisiert sowie finanziert werden kann. Hierauf soll der zur Erarbeitung empfohlene Masterplan „Mobilität Münster 2035+“ ziel- und umsetzungsorientierte Antworten geben. Damit ist der Masterplan ein zentraler Baustein für die dynamisch wachsende Stadt Münster. Im regionalen Kontext wird Münster damit zum Impulsgeber der Entwicklung eines zukunftsfähigen integrativen Mobilitätskonzeptes.",5,(5),Vneu


,V1,"Klimaschutz als zentrale Zielstellung im Verkehrsentwicklungsplan 2025","Klimaschutz als zentrale Zielstellung im Verkehrsentwicklungsplan 2025",4,(3),V
white,V1-Plan,"geplant","Zur Ausrichtung der zukünftigen Klima schonenden Verkehrsplanungen sollte der Klimaschutzaspekt in den VEP Münster 2025 aufgenommen werden und durch ein Moni-
toring die Verkehrsentwicklung mittels regelmäßig aktualisierter Nachhaltigkeits- bzw.
Klimaschutzindikatoren überprüft werden.",4,(3),V1
red,V1-13,"Sachstand 2013","kein neuer Sachstand",4,(3),V1
red,V1-1516,"Sachstand 2015 / 2016","Die Verkehrsplanung betreibt ein regelmäßiges Monitoring der Verkehrsentwicklung im Stadtgebiet und im Stadt-Umland-Verkehr. So werden:<br>• Die gesamtverkehrlichen Entwicklungen werden bereits seit 1982 durch turnusmäßige Haushaltsbefragungen nachgehalten.<br>• Die Entwicklungen im MIV werden durch regelmäßige Handzählungen und durch kontinuierliche automatische Zählungen an den Signalanlagen überwacht.<br>• Wesentliche Knoten im Hauptverkehrsstraßennetz werden im Abstand von ca. 5 Jahren gezählt.<br>• Die automatisierten Radzählstellen (derzeit 8) auf bedeutenden Radverkehrsachsen werden kontinuierlich ausgebaut.<br>• Neben regelmäßigen Befragungen der Fahrgäste in den Stadtbuslinien werden seit 2016 auch die Ein-/Aussteigerzahlen automatisiert erfasst.<br> Zusätzlich werden anlassbezogen Zählungen durchgeführt. Die Ergebnisse dieser Erhebungen fließen zum einen in das Verkehrsmodell der Stadt Münster ein. Dieses Verkehrsmodell bildet die Basis vieler Verkehrsuntersuchungen, die z.B. im Rahmen von B-Plan-Verfahren durch die Verkehrsplanung erstellt werden. Auch der 3. Nahverkehrsplan stützt sich auf Daten, die durch diese regelmäßigen Erhebungen zur Verfügung stehen.",4,(3),V1
red,V1-1718,"Sachstand 2017 / 2018","Ergänzend zum Sachstand 2015/2016 hat der Haupt- und Finanzausschuss am 06.12.2017 mit dem Beschluss der Vorlage V/0802/2017 den „Masterplan Mobilität Münster 2035+“ beschlossen. Die Erstellung eines Masterplans „Mobilität Münster 2035+“ steht auch unter der Zielsetzung, die hohen NOx- und CO 2 -Werte zu reduzieren. Er soll einen maßgeblichen Beitrag zu einem zukunftsfähigen und nachhaltigen Verkehrsgeschehen in der Stadt Münster liefern. In diesem Sinne ist er die „verkehrliche Säule“ eines übergeordneten „green-city-plans (GCP)“. Vor diesem Hintergrund hat die Verwaltung im Herbst 2017 einen Antrag zum Förderprogramm „Automatisierung und Vernetzung im Straßenverkehr“ des Bundesministeriums für Verkehr und digitale Infrastruktur gestellt. Der Bund hat diesen Antrag zur nachhaltigen Entwicklung eines emissionsarmen, stadtverträglichen und ressourcenschonenden Gesamtverkehrs der Stadt Münster (GCP Münster)“ bewilligt. Daraufhin hat die Verwaltung zur Vorbereitung des Masterplan Mobilität Münster 2035+ eine zweistufige Expertise „Vorzeitige Gestaltung des Zukunftsprozesses Masterplan Mobilität Münster 2035+“ vergeben:<br>Stufe 1: Sichtung und Bewertung vorhandener verkehrlicher Programme, Projekte und Prozesse (z. B. 3. Nahverkehrsplan Stadt Münster, Radverkehrskonzept Münster, Lärmaktionsplan Stadt Münster, Luftreinhalteplan Stadt Münster, Wohnbaulandprogramm, Integriertes Stadtentwicklungskonzept, Münster Zukünfte 20/30/50, Global Nachhaltige Kommune) mit Wirkungsaussagen zur NOx- und CO 2 -Reduzierung.<br>Stufe 2: Projektskizze zu den Bearbeitungsinhalten und der Vorgehensweise „Masterplan Mobilität Münster 2035+“ unter der Maßgabe einer möglichst hohen Reduzierung der NOx- und CO 2 -Werte.",4,(3),V1
